,doc.id,title,citeulike.id,raw.title,raw.abstract
271,272,the independent components of natural scenes are edge filters,4190.0,The `Independent Components' of Natural Scenes are Edge Filters,"It has previously been suggested that neurons with line and edge selectivities found in primary visual cortex of cats and monkeys form a sparse, distributed representation of natural scenes, and it has been reasoned that such responses should emerge from an unsupervised learning algorithm that attempts to find a factorial code of independent visual features. We show here that a new unsupervised learning algorithm based on information maximization, a nonlinear “infomax” network, when applied to an ensemble of natural scenes produces sets of visual filters that are localized and oriented. Some of these filters are Gabor-like and resemble those produced by the sparseness-maximization network. In addition, the outputs of these filters are as independent as possible, since this infomax network performs Independent Components Analysis or ICA, for sparse (super-gaussian) component distributions. We compare the resulting ICA filters and their associated basis functions, with other decorrelating filters produced by Principal Components Analysis (PCA) and zero-phase whitening filters (ZCA). The ICA filters have more sparsely distributed (kurtotic) outputs on natural scenes. They also resemble the receptive fields of simple cells in visual cortex, which suggests that these neurons form a natural, information-theoretic coordinate system for natural images."
278,279,filtering algorithms and implementation for very fast publishsubscribe systems,4291.0,Filtering algorithms and implementation for very fast publish/subscribe systems,"Publish/Subscribe is the paradigm in which users express long-term interests (&ldquo;subscriptions&rdquo;) and some agent &ldquo;publishes&rdquo; events (e.g., offers). The job of Publish/Subscribe software is to send events to the owners of subscriptions satisfied by those events. For example, a user subscription may consist of an interest in an airplane of a certain type, not to exceed a certain price. A published event may consist of an offer of an airplane with certain properties including price. Each subscription consists of a conjunction of (attribute, comparison operator, value) predicates. A subscription closely resembles a trigger in that it is a long-lived conditional query associated with an action (usually, informing the subscriber). However, it is less general than a trigger so novel data structures and implementations may enable the creation of more scalable, high performance publish/subscribe systems. This paper describes an attempt at the construction of such algorithms and its implementation. Using a combination of data structures, application-specific caching policies, and application-specific query processing our system can handle 600 events per second for a typical workload containing 6 million subscriptions."
281,282,a scalable contentaddressable network,4300.0,A scalable content-addressable network,"Hash tables – which map “keys ” onto “values ”  – are an essential building block in modern software systems. We believe a similar functionality would be equally valuable to large distributed systems. In this paper, we introduce the concept of a Content-Addressable Network (CAN) as a distributed infrastructure that provides hash table-like functionality on Internetlike scales. The CAN design is scalable, fault-tolerant and completely selforganizing, and we demonstrate its scalability, robustness and low-latency properties through simulation. 1"
288,289,statistical analysis of domains in interacting protein pairs,4376.0,Statistical analysis of domains in interacting protein pairs.,"ABSTRACT Motivation: Several methods have recently been developed to analyse large-scale sets of physical interactions between proteins in terms of physical contacts between the constituent domains, often with a view to predicting new pairwise interactions. Our aim is to combine genomic interaction data, in which domain--domain contacts are not explicitly reported, with the domain-level structure of individual proteins, in order to learn about the structure of interacting protein pairs. Our approach is driven by the need to assess the evidence for physical contacts between domains in a statistically rigorous way. Results: We develop a statistical approach that assigns p-values to pairs of domain superfamilies, measuring the strength of evidence within a set of protein interactions that domains from these superfamilies formcontacts. A set of p-values is calculated for SCOP superfamily pairs, based on a pooled data set of interactions from yeast. These p-values can be used to predict which domains come into contact in an interacting protein pair. This predictive scheme is tested against protein complexes in the Protein Quaternary Structure (PQS) database, and is used to predict domain--domain contacts within 705 interacting protein pairs taken from our pooled data set."
292,293,how did alternative splicing evolve,4483.0,How did alternative splicing evolve?,"Alternative splicing creates transcriptome diversification, possibly leading to speciation. A large fraction of the protein-coding genes of multicellular organisms are alternatively spliced, although no regulated splicing has been detected in unicellular eukaryotes such as yeasts. A comparative analysis of unicellular and multicellular eukaryotic 5' splice sites has revealed important differences - the plasticity of the 5' splice sites of multicellular eukaryotes means that these sites can be used in both constitutive and alternative splicing, and for the regulation of the inclusion/skipping ratio in alternative splicing. So, alternative splicing might have originated as a result of relaxation of the 5' splice site recognition in organisms that originally could support only constitutive splicing."
293,294,the google similarity distance,4487.0,The Google Similarity Distance,"Words and phrases acquire meaning from the way they are used in society, from their relative semantics to other words and phrases. For computers, the equivalent of ""society&#8221; is ""database,&#8221; and the equivalent of ""use&#8221; is ""a way to search the database.&#8221; We present a new theory of similarity between words and phrases based on information distance and Kolmogorov complexity. To fix thoughts, we use the World Wide Web (WWW) as the database, and Google as the search engine. The method is also applicable to other search engines and databases. This theory is then applied to construct a method to automatically extract similarity, the Google similarity distance, of words and phrases from the WWW using Google page counts. The WWW is the largest database on earth, and the context information entered by millions of independent users averages out to provide automatic semantics of useful quality. We give applications in hierarchical clustering, classification, and language translation. We give examples to distinguish between colors and numbers, cluster names of paintings by 17th century Dutch masters and names of books by English novelists, the ability to understand emergencies and primes, and we demonstrate the ability to do a simple automatic English-Spanish translation. Finally, we use the WordNet database as an objective baseline against which to judge the performance of our method. We conduct a massive randomized trial in binary classification using support vector machines to learn categories based on our Google distance, resulting in an a mean agreement of 87 percent with the expert crafted WordNet categories."
294,295,reinforcement learning a survey,4578.0,Reinforcement Learning: A Survey,"This paper surveys the field of reinforcement learning from a computer-science perspective. It is written to be accessible to researchers familiar with machine learning. Both the historical basis of the field and a broad selection of current work are summarized. Reinforcement learning is the problem faced by an agent that learns behavior through trial-and-error interactions with a dynamic environment. The work described here has a resemblance to work in psychology, but differs considerably in the details and in the use of the word ``reinforcement.'' The paper discusses central issues of reinforcement learning, including trading off exploration and exploitation, establishing the foundations of the field via Markov decision theory, learning from delayed reinforcement, constructing empirical models to accelerate learning, making use of generalization and hierarchy, and coping with hidden state. It concludes with a survey of some implemented systems and an assessment of the practical utility of current methods for reinforcement learning."
299,300,accurate multiplex gene synthesis from programmable dna microchips,4659.0,Accurate multiplex gene synthesis from programmable DNA microchips,"Testing the many hypotheses from genomics and systems biology experiments demands accurate and cost-effective gene and genome synthesis. Here we describe a microchip-based technology for multiplex gene synthesis. Pools of thousands of 'construction' oligonucleotides and tagged complementary 'selection' oligonucleotides are synthesized on photo-programmable microfluidic chips1, released, amplified and selected by hybridization to reduce synthesis errors ninefold. A one-step polymerase assembly multiplexing reaction assembles these into multiple genes. This technology enabled us to synthesize all 21 genes that encode the proteins of the Escherichia coli 30S ribosomal subunit, and to optimize their translation efficiency in vitro through alteration of codon bias. This is a significant step towards the synthesis of ribosomes in vitro and should have utility for synthetic biology in general."
312,313,the price dynamics of common trading strategies,4926.0,The price dynamics of common trading strategies,"A deterministic trading strategy can be regarded as as signal processing element that uses external information and past prices as inputs and incorporates them into future prices. This paper uses a market maker based method of price formation to study the price dynamics induced by several commonly used financial trading strategies, showing how they amplify noise, induce structure in prices, and cause phenomena such as excess and clustered volatility."
313,314,wormbase a comprehensive data resource for caenorhabditis biology and genomics,4931.0,WormBase: a comprehensive data resource for Caenorhabditis biology and genomics.,"WormBase (http://www.wormbase.org), the model organism database for information about Caenorhabditis elegans and related nematodes, continues to expand in breadth and depth. Over the past year, WormBase has added multiple large-scale datasets including SAGE, interactome, 3D protein structure datasets and NCBI KOGs. To accommodate this growth, the International WormBase Consortium has improved the user interface by adding new features to aid in navigation, visualization of large-scale datasets, advanced searching and data mining. Internally, we have restructured the database models to rationalize the representation of genes and to prepare the system to accept the genome sequences of three additional Caenorhabditis species over the coming year. 10.1093/nar/gki066"
314,315,a repository of our own the elis eprints archive,4932.0,A repository of our own: the E-LIS e-prints archive,"			This article reviews the E-Prints in Library and Information Science (E-LIS) open access archive. E-LIS is part of the Research in Computing, Library and Information Science (RCLIS) project, an international effort to organize and disseminate scholarly papers in librarianship and related fields. E-LIS uses open source applications, and joins a growing number of OAI-compliant services dedicated to providing free access to scholarly information."
315,316,using terminological feedback for web search refinement a logbased study,4936.0,Using terminological feedback for web search refinement: a log-based study,"Although interactive query reformulation has been actively studied in the laboratory, little is known about the actual behavior of web searchers who are offered terminological feedback along with their search results. We analyze log sessions for two groups of users interacting with variants of the AltaVista search engine - a baseline group given no terminological feedback and a feedback group to whom twelve refinement terms are offered along with the search results. We examine uptake, refinement effectiveness, conditions of use, and refinement type preferences. Although our measure of overall session ""success"" shows no difference between outcomes for the two groups, we find evidence that a subset of those users presented with terminological feedback do make effective use of it on a continuing basis."
316,317,a usercentred approach to functions in excel,4952.0,A User-Centred Approach to Functions in Excel,"We describe extensions to the Excel spreadsheet that integrate userdefined functions into the spreadsheet grid, rather than treating them as a “bolt-on”. Our first objective was to bring the benefits of additional programming language features to a system that is often not recognised as a programming language. Second, in a project involving the evolution of a well-established language, compatibility with previous versions is a major issue, and maintaining this compatibility was our second objective. Third and most important, the commercial success of spreadsheets is largely due to the fact that many people find them more usable than programming languages for programming-like tasks. Thus, our third objective (with resulting constraints) was to maintain this usability advantage. Simply making Excel more like a conventional programming language would not meet these objectives and constraints. We have therefore taken an approach to our design work that emphasises the cognitive requirements of the user as a primary design criterion. The analytic approach that we demonstrate in this project is based on recent developments in the study of programming usability, including the Cognitive Dimensions of Notations and the Attention Investment model of abstraction use. We believe that this approach is also applicable to the design and extension of other programming languages and environments."
317,318,type classes in haskell,4956.0,Type Classes in Haskell,"This article defines a set of type inference rules for resolving overloading introduced by type classes, as used in the functional programming language Haskell. Programs including type classes are transformed into ones which may be typed by standard Hindley-Milner inference rules. In contrast to other work on type classes, the rules presented here relate directly to Haskell programs. An innovative aspect of this work is the use of second-order lambda calculus to record type information in the transformed program."
318,319,how to make adhoc polymorphism less ad hoc,4958.0,How to make ad-hoc polymorphism less ad hoc,"This paper presents  type classes , a new approach to  ad-hoc  polymorphism. Type classes permit overloading of arithmetic operators such as multiplication, and generalise the &ldquo;eqtype variables&rdquo; of Standard ML. Type classes extend the Hindley/Milner polymorphic type system, and provide a new approach to issues that arise in object-oriented programming, bounded type quantification, and abstract data types. This paper provides an informal introduction to type classes, and defines them formally by means of type inference rules."
319,320,representing control a study of the cps transformation,4962.0,Representing Control: A study of the CPS transformation,"This paper investigates the transformation of v-terms into continuation-passing style (CPS). We show that by appropriate j-expansion of Fischer and Plotkin&#039;s two-pass equational specification of the CPS transform, we can obtain a static and context-free separation of the result terms into &amp;quot;essential &amp;quot; and &amp;quot;administrative &amp;quot; constructs. Interpreting the former as syntax builders and the latter as directly executable code, we obtain a simple and efficient one-pass transformation algorithm, easily extended to conditional expressions, recursive definitions, and similar constructs. This new transformation algorithm leads to a simpler proof of Plotkin&#039;s simulation and indifference results. We go on to show how CPS-based control operators similar to, but more general than, Scheme&#039;s call/cc can be naturally accommodated by the new transformation algorithm. To demonstrate the expressive power of these operators, we use them to present an equivalent but even more concise formulation of the efficient CPS transformation algorithm. Finally, we relate the fundamental ideas underlying this derivation to similar concepts from other works on program manipulation; we derive a one-pass CPS transformation of n-terms; and we outline some promising areas for future research."
321,322,stochastic lambda calculus and monads of probability distributions,4973.0,Stochastic lambda calculus and monads of probability distributions,"Probability distributions are useful for expressing the meanings of probabilistic languages, which support formal modeling of and reasoning about uncertainty. Probability distributions form a monad, and the monadic definition leads to a simple, natural semantics for a stochastic lambda calculus, as well as simple, clean implementations of common queries. But the monadic implementation of the expectation query can be much less efficient than current best practices in probabilistic modeling. We therefore present a language of measure terms, which can not only denote discrete probability distributions but can also support the best known modeling techniques. We give a translation of stochastic lambda calculus into measure terms. Whether one translates into the probability monad or into measure terms, the results of the translations denote the same probability distribution."
322,323,the alternative splicing gallery asg bridging the gap between genome and transcriptome,4990.0,The Alternative Splicing Gallery (ASG): bridging the gap between genome and transcriptome,"Alternative splicing essentially increases the diversity of the transcriptome and has important implications for physiology, development and the genesis of diseases. Conventionally, alternative splicing is investigated in a case-by-case fashion, but this becomes cumbersome and error prone if genes show a huge abundance of different splice variants. We use a different approach and integrate all transcripts derived from a gene into a single splicing graph. Each transcript corresponds to a path in the graph, and alternative splicing is displayed by bifurcations. This representation preserves the relationships between different splicing variants and allows us to investigate systematically all possible putative transcripts. We built a database of splicing graphs for human genes, using transcript information from various major sources (Ensembl, RefSeq, STACK, TIGR and UniGene). A Web interface allows users to display the splicing graphs, to interactively assemble transcripts and to access their sequences as well as neighboring genomic regions. We also provide for each gene an exhaustive pre-computed catalog of putative transcripts--in total more than 1.2 million sequences. We found that [~]65% of the investigated genes show evidence for alternative splicing, and in 5% of the cases, a single gene might produce over 100 transcripts. 10.1093/nar/gkh731"
323,324,splicing graphs and est assembly problem,4991.0,Splicing graphs and EST assembly problem,"10.1093/bioinformatics/18.suppl_1.S181 Motivation: The traditional approach to annotate alternative splicing is to investigate every splicing variant of the gene in a case-by-case fashion. This approach, while useful, has some serious shortcomings. Recent studies indicate that alternative splicing is more frequent than previously thought and some genes may produce tens of thousands of different transcripts. A list of alternatively spliced variants for such genes would be difficult to build and hard to analyse. Moreover, such a list does not show the relationships between different transcripts and does not show the overall structure of all transcripts. A better approach would be to represent all splicing variants for a given gene in a way that captures the relationships between different splicing variants.Results: We introduce the notion of the splicing graph that is a natural and convenient representation of all splicing variants. The key difference with the existing approaches is that we abandon the linear (sequence) representation of each transcript and replace it with a graph representation where each transcript corresponds to a path in the graph. We further design an algorithm to assemble EST reads into the splicing graph rather than assembling them into each splicing variant in a case-by-case fashion.Availability: http://www-cse.ucsd.edu/groups/bioinformatics/software.htmlContact: sheber@ucsd.eduKeywords: EST assembly; splicing graph; alternative splicing"
324,325,oaipp a peertopeer network for open archives,4996.0,OAI-P2P: A Peer-to-Peer Network for Open Archives,"OAI is designed with a low-barrier technology approach, thus allowing institutions to provide content metadata with little effort. On the other hand, search capabilities are very limited on OAI data providers, and have to be provided by separate service providers. We propose that data providers form a peer-to-peer network which supports distributed search over all connected metadata repositories. Such an approach is already implemented for learning content metadata (project 'Edutella'). We..."
326,327,landmarc indoor location sensing using active rfid,5787.0,LANDMARC: Indoor Location Sensing Using Active RFID,"Growing convergence among mobile computing devices and embedded technology sparks the development and deployment of “context-aware” applications, where location is the most essential context. In this paper we present LANDMARC, a location sensing prototype system that uses Radio Frequency Identification (RFID) technology for locating objects inside buildings. The major advantage of LANDMARC is that it improves the overall accuracy of locating objects by utilizing the concept of reference tags. Based on experimental analysis, we demonstrate that active RFID is a viable and cost-effective candidate for indoor location sensing. Although RFID is not designed for indoor location sensing, we point out three major features that should be added to make RFID technologies competitive in this new and growing market."
327,328,wireless broadband drivers and their social implications,8851.0,Wireless broadband drivers and their social implications,"Wireless local area networks now offer high-speed Internet access at numerous locations in both public and private environments. Associated with this rapid growth, numerous social implications come to the fore, especially relating to practices, such as the free use and shar- ing of bandwidth. Using case-based comparative analysis, we examine three primary strate- gies involved in providing wireless broadband access. Based on this research, we discuss the future of Wi-Fi growth, emergent competing technologies, and the broad social implications of this phenomenon."
328,329,a tutorial on support vector regression,9972.0,A tutorial on support vector regression,"In this tutorial we give an overview of the basic ideas underlying Support Vector (SV) machines for regression and function estimation. Furthermore, we include a summary of currently used algorithms for training SV machines, covering both the quadratic (or convex) programming part and advanced methods for dealing with large datasets. Finally, we mention some modifications and extensions that have been applied to the standard SV algorithm, and discuss the aspect of regularization and capacity control from a SV point of view."
329,330,multimodel inference,11258.0,Multimodel Inference,"The model selection literature has been generally poor at reflecting the deep foundations of the Akaike information criterion (AIC) and at making appropriate comparisons to the Bayesian information criterion (BIC). There is a clear philosophy, a sound criterion based in information theory, and a rigorous statistical foundation for AIC. AIC can be justified as Bayesian using a âsavvyâ prior on models that is a function of sample size and the number of model parameters. Furthermore, BIC can be derived as a non-Bayesian result. Therefore, arguments about using AIC versus BIC for model selection cannot be from a Bayes versus frequentist perspective. The philosophical context of what is assumed about reality, approximating models, and the intent of model-based inference should determine whether AIC or BIC is used. Various facets of such multimodel inference are presented here, particularly methods of model averaging."
