,doc.id,title,citeulike.id,raw.title,raw.abstract
130,131,using graphical models and genomic expression data to statistically validate models of genetic regulatory networks,1023.0,Using graphical models and genomic expression data to statistically validate models of genetic regulatory networks.,"We propose a model-driven approach for analyzing genomic expression data that permits genetic regulatory networks to be represented in a biologically interpretable computational form. Our models permit latent variables capturing unobserved factors, describe arbitrarily complex (more than pair-wise) relationships at varying levels of refinement, and can be scored rigorously against observational data. The models that we use are based on Bayesian networks and their extensions. As a demonstration of this approach, we utilize 52 genomes worth of Affymetrix GeneChip expression data to correctly differentiate between alternative hypotheses of the galactose regulatory network in S. cerevisiae. When we extend the graph semantics to permit annotated edges, we are able to score models describing relationships at a finer degree of specification. 1 Introduction The vast quantity of data generated by genomic expression arrays affords researchers a significant opportunity to transform biology, medicine, and pharmacology using systematic computational methods. The availability of genomic (and eventually proteomic) expression data promises to have a profound impact on the understanding of basic cellular processes, the diagnosis and treatment of disease, and the efficacy of designing and delivering targeted therapeutics. Particularly relevant to these objectives is the development of a deeper understanding of the various mechanisms by which cells control and regulate the transcription of their genes. In this paper, we present a principled method for using genomic expression data to elucidate these genetic regulatory networks. While the potential utility of expression data is immense, some obstacles"
131,132,advances to bayesian network inference for generating causal networks from observational biological data,1024.0,Advances to Bayesian network inference for generating causal networks from observational biological data,"Motivation: Network inference algorithms are powerful computational tools for identifying putative causal interactions among variables from observational data. Bayesian network inference algorithms hold particular promise in that they can capture linear, non-linear, combinatorial, stochastic and other types of relationships among variables across multiple levels of biological organization. However, challenges remain when applying these algorithms to limited quantities of experimental data collected from biological systems. Here, we use a simulation approach to make advances in our dynamic Bayesian network (DBN) inference algorithm, especially in the context of limited quantities of biological data.  Results: We test a range of scoring metrics and search heuristics to find an effective algorithm configuration for evaluating our methodological advances. We also identify sampling intervals and levels of data discretization that allow the best recovery of the simulated networks. We develop a novel influence score for DBNs that attempts to estimate both the sign (activation or repression) and relative magnitude of interactions among variables. When faced with limited quantities of observational data, combining our influence score with moderate data interpolation reduces a significant portion of false positive interactions in the recovered networks. Together, our advances allow DBN inference algorithms to be more effective in recovering biological networks from experimentally collected data.  Availability: Source code and simulated data are available upon request.  Supplementary information: http://www.jarvislab.net/Bioinformatics/BNAdvances/ 10.1093/bioinformatics/bth448"
132,133,a survey of approaches to automatic schema matching,1039.0,A survey of approaches to automatic schema matching,"Abstract. Schema matching is a basic problem in many database application domains, such as data integration, E-business, data warehousing, and semantic query processing. In current implementations, schema matching is typically performed manually, which has significant limitations. On the other hand, previous research papers have proposed many techniques to achieve a partial automation of the match operation for specific application domains. We present a taxonomy that covers many of these existing approaches, and we describe the approaches in some detail. In particular, we distinguish between schema-level and instance-level, element-level and structure-level, and language-based and constraint-based matchers. Based on our classification we review some previous match implementations thereby indicating which part of the solution space they cover. We intend our taxonomy and review of past work to be useful when comparing different approaches to schema matching, when developing a new match algorithm, and when implementing a schema matching component."
133,134,cowl contextualizing ontologies,1043.0,C-OWL: Contextualizing ontologies,"Ontologies are shared models of a domain that encode a view which is common to a set of different parties. Contexts are local models that encode a party's subjective view of a domain. In this paper we show how ontologies can be contextualized, thus acquiring certain useful properties that a pure shared approach cannot provide. We say that an ontology is contextualized or, also, that it is a contextual ontology, when its contents are kept local, and therefore not shared with other ontologies, and mapped with the contents of other ontologies via explicit (context) mappings. The result is Context OWL (C-OWL), a language whose syntax and semantics have been obtained by extending the OWL syntax and semantics to allow for the representation of contextual ontologies."
134,135,integrated semanticsyntactic video modeling for search and browsing,1064.0,Integrated Semantic-Syntactic Video Modeling for Search and Browsing,"Video processing and computer vision communities usually employ shot-based or object-based structural video models and associate low-level (color, texture, shape, and motion) and semantic descriptions (textual annotations) with these structural (syntactic) elements. Database and information retrieval communities, on the other hand, employ entity-relation or object-oriented models to model the semantics of multimedia documents. This paper proposes a new generic integrated semantic-syntactic video model to include all of these elements within a single framework to enable structured video search and browsing combining textual and low-level descriptors. The proposed model includes semantic entities (video objects and events) and the relations between them. We introduce a new ""actor"" entity to enable grouping of object roles in specific events. This context-dependent classification of attributes of an object allows for more efficient browsing and retrieval. The model also allows for decomposition of events into elementary motion units and elementary reaction/interaction units in order to access mid-level semantics and low-level video features. The instantiations of the model are expressed as graphs. Users can formulate flexible queries that can be translated into such graphs. Alternatively, users can input query graphs by editing an abstract model (model template). Search and retrieval is accomplished by matching the query graph with those instantiated models in the database. Examples and experimental results are provided to demonstrate the effectiveness of the proposed integrated modeling and querying framework."
136,137,time as essence for photo browsing through personal digital libraries,1100.0,Time as essence for photo browsing through personal digital libraries,"We developed two photo browsers for collections with thousands of time-stamped digital images. Modern digital cameras record photo shoot times, and semantically related photos tend to occur in bursts. Our browsers exploit the timing information to structure the collections and to automatically generate meaningful summaries. The browsers differ in how users navigate and view the structured collections. We conducted user studies to compare the two browsers and an un-summarized image browser. Our results show that exploiting the time dimension and appropriately summarizing collections can lead to significant improvements. For example, for one task category, one of our browsers enabled a 33\\ improvement in speed of finding given images compared to the commercial browser. Similarly, users were able to complete 29% more tasks when using this same browser."
137,138,automatic organization for digital photographs with geographic coordinates,1101.0,Automatic organization for digital photographs with geographic coordinates,"Uses time and location information in the EXIF header to automatically organise a personal photograph collection. Foruses on auto-genereating a structure that can be used WITHOUT A MAP. Makes a nice point about the inneficient use of screen real estate when using maps, and that zooming an paning could be cumbersome. The paper presents the algorithm for grouping by time and location for event detection. The tool generates a text caption to describe (by location) each grouping--this is crucial since no map. Description/evaluation of the user interface is left for future work. Evaluation: the algorithms are tested on three image collections (2580, 1192, 1823 images) . This could be interesting to look at again when writing the machine learning stuff."
138,139,two supervised learning approaches for name disambiguation in author citations,1108.0,Two supervised learning approaches for name disambiguation in author citations,"Due to name abbreviations, identical names, name misspellings,  and pseudonyms in publications or bibliographies (citations), an  author may have multiple names and multiple authors may share  the same name. Such name ambiguity affects the performance  of document retrieval, web search, database integration, and may  cause improper attribution to authors. This paper investigates two  supervised learning approaches to disambiguate authors in the citations.   One approach uses the naive Bayes probability model, a  generative model; the other uses Support Vector Machines(SVMs)  [The Nature of Statistical Learning Theory] and the vector space representation of citations,   a discriminative model. Both approaches utilize three types of citation attributes:  co-author names, the title of the paper, and the title of  the journal or proceeding. We illustrate these two approaches on  two types of data, one collected from the web, mainly publication  lists from homepages, the other collected from the DBLP citation databases."
139,140,toward an understanding of the motivation of open source software developers,1109.0,Toward an Understanding of the Motivation of Open Source Software Developers,"An Open Source Software (OSS) project is unlikely to  be successful unless there is an accompanied community  that provides the platform for developers and users to  collaborate. Members of such communities are volunteers  whose motivation to participate and contribute is of  essential importance to the success of OSS projects. In  this paper, we aim to create an understanding of what  motivates people to participate in OSS communities. We  theorize that learning is one of the motivational forces.  Our theory is grounded in the learning theory of  Legitimate Peripheral Participation, and is supported by  analyzing the social structure of OSS communities and the  co-evolution between OSS systems and communities. We  also discuss practical implications of our theory for  creating and maintaining sustainable OSS communities as  well as for software engineering research and education."
140,141,bibliometrics and beyond some thoughts on webbased citation analysis,1113.0,Bibliometrics and beyond: some thoughts on web-based citation analysis,"The idea of a unified citation index to the literature of science was first outlined by Eugene Garfield [1] in 1955 in the journal Science. Science  Citation Index has since established itself as the gold standard for scientific information retrieval. It has also become the database of choice for citation analysts and evaluative bibliometricians worldwide. As scientific publication moves to the web, and novel approaches to scholarly communication  and peer review establish themselves, new methods of citation and link analysis will emerge to capture often liminal expressions of peer esteem, influence and approbation. The web thus affords bibliometricians rich opportunities to apply   and adapt their techniques to new contexts and content: the age of  bibliometric spectroscopy' [2] is dawning. 10.1177/016555150102700101"
141,142,adding semantics to web services standards,1125.0,Adding semantics to web services standards,"With the increasing growth in popularity of Web services, discovery of relevant Web services becomes a significant challenge. One approach is to develop semantic Web services where by the Web services are annotated based on shared ontologies, and use these annotations for semantics-based discovery of relevant Web services. We discuss one such approach that involves adding semantics to WSDL using DAML+OIL ontologies. Our approach also uses UDDI to store these semantic annotations and search for..."
142,143,analysis of a very large web search engine query log,1126.0,Analysis of a very large web search engine query log,"In this paper we present an analysis of an AltaVista Search Engine query log consisting of approximately 1 billion entries for search requests over a period of six weeks. This represents almost 285 million user sessions, each an attempt to fill a single information need. We present an analysis of individual queries, query duplication, and query sessions. We also present results of a correlation analysis of the log entries, studying the interaction of terms within queries. Our data supports the conjecture that web users differ significantly from the user assumed in the standard information retrieval literature. Specifically, we show that web users type in short queries, mostly look at the first 10 results only, and seldom modify the query. This suggests that traditional information retrieval techniques may not work well for answering web search requests. The correlation analysis showed that the most highly correlated items are constituents of phrases. This result indicates it may be useful for search engines to consider search terms as parts of phrases even if the user did not explicitly specify them as such."
143,144,relevant term suggestion in interactive web search based on contextual information in query session logs,1130.0,Relevant term suggestion in interactive web search based on contextual information in query session logs,"Abstract 10.1002/asi.10256.abs This paper proposes an effective term suggestion approach to interactive Web search. Conventional approaches to making term suggestions involve extracting co-occurring keyterms from highly ranked retrieved documents. Such approaches must deal with term extraction difficulties and interference from irrelevant documents, and, more importantly, have difficulty extracting terms that are conceptually related but do not frequently co-occur in documents. In this paper, we present a new, effective log-based approach to relevant term extraction and term suggestion. Using this approach, the relevant terms suggested for a user query are those that co-occur in similar query sessions from search engine logs, rather than in the retrieved documents. In addition, the suggested terms in each interactive search step can be organized according to its relevance to the entire query session, rather than to the most recent single query as in conventional approaches. The proposed approach was tested using a proxy server log containing about two million query transactions submitted to search engines in Taiwan. The obtained experimental results show that the proposed approach can provide organized and highly relevant terms, and can exploit the contextual information in a user's query session to make more effective suggestions."
144,145,agglomerative clustering of a search engine query log,1132.0,Agglomerative clustering of a search engine query log,"This paper introduces a technique for mining a collection of user transactions with an Internet search engine to discover clusters of similar queries and similar URLs. The information we exploit is clickthrough data: each record consists of a user's query to a search engine along with the URL which the user selected from among the candidates offered by the search engine. By viewing this dataset as a bipartite graph, with the vertices on one side corresponding to queries and on the other side..."
145,146,regionbased memory management,1134.0,Region-Based Memory Management,"This paper describes a memory management discipline for programs that perform dynamic memory allocation and de-allocation. At runtime, all values are put into regions. The store consists of a stack of regions. All points of region allocation and deallocation are inferred automatically, using a type and effect based program analysis. The scheme does not assume the presence of a garbage collector. The scheme was first presented by Tofte and Talpin (1994); subsequently, it has been tested in The ML Kit with Regions, a region-based, garbage-collection free implementation of the Standard ML Core language, which includes recursive datatypes, higher-order functions and updatable references (Birkedal et al. 96, Elsman and Hallenberg 95). This paper defines a region-based dynamic semantics for a skeletal programming language extracted from Standard ML. We present the inference system which specifies where regions can be allocated and de-allocated and a detailed proof that the system is sound wi..."
146,147,language support for regions,1136.0,Language Support for Regions,"Region-based memory management systems structure memory by grouping objects in regions under program control. Memory is reclaimed by deleting regions, freeing all objects stored therein. Our compiler for C with regions, RC, prevents unsafe region deletions by keeping a count of references to each region. Using type annotations that make the structure of a program's regions more explicit, we reduce the overhead of reference counting from a maximum of 27\% to a maximum of 11\% on a suite of realistic benchmarks. We generalise these annotations in a region type system whose main novelty is the use of existentially quantified abstract regions to represent pointers to objects whose region is partially or totally unknown. A distribution of RC is available at http://www.cs.berkeley.edu/~dgay/rc.tar.gz."
148,149,expertise recommender a flexible recommendation system and architecture,1159.0,Expertise recommender: a flexible recommendation system and architecture,"Locating the expertise necessary to solve difficult problems is a nuanced social and collaborative problem. In organizations, some people assist others in locating expertise by making referrals. People who make referrals fill key organizational roles that have been identified by CSCW and affiliated research. Expertise locating systems are not designed to replace people who fill these key organizational roles. Instead, expertise locating systems attempt to decrease workload and support people who have no other options. Recommendation systems are collaborative software that can be applied to expertise locating. This work describes a general recommendation architecture that is grounded in a field study of expertise locating. Our expertise recommendation system details the work necessary to fit expertise recommendation to a work setting. The architecture and implementation begin to tease apart the technical aspects of providing good recommendations from social and collaborative concerns."
149,150,fotofile a consumer multimedia organization and retrieval system,1161.0,FotoFile: a consumer multimedia organization and retrieval system,"FotoFile blends automatic and human annotation methods. Users express frustration re: organizing and retrieving digital images. Conducted focus groups to gain insight into the percieved tradeoffs between: manual vs. automated annotattion and direct search vs. browsing. Different focus groups were held for business and home participants. Keyword based search easiest to grasp, but time requuirements seen as daunting. Automated indexing (content based) desired, but home users thought they'd do keywords more, browsing more desired by home users than business. The primary orgaizational metaphor is an album, and useres can specify the representative image to aid in recognition. Batch annotation is supported, annotation and search use the same basic mechanism. Storytelling is discussed as a means of facilitating annotation--allows for small grouping of photos, part of a story--called scraplets, to be named and annotated. Using the same photos in mutliple scraplets links them implicitly--links are shown during album playback to remind of multiple possible story lines. Face recognition is implemented and black rectangles are placed on thumbnails to indicate recognized faces--users are prompted to confirm person's identity, all images auto annoted w/ the person's name. Metadata is visualized using the hyperbolic tree. Good discussion of the difficulties in designing meaningful studies in this area."
150,151,composable and compilable macros you want it when,1164.0,Composable and compilable macros:: you want it when?,"Many macro systems, especially for Lisp and Scheme, allow macro transformers to perform general computation. Moreover, the language for implementing compile-time macro transformers is usually the same as the language for implementing run-time functions. As a side effect of this sharing, implementations tend to allow the mingling of compile-time values and run-time values, as well as values from separate compilations. Such mingling breaks programming tools that must parse code without executing it. Macro implementors avoid harmful mingling by obeying certain macro-definition protocols and by inserting phase-distinguishing annotations into the code. However, the annotations are fragile, the protocols are not enforced, and programmers can only reason about the result in terms of the compiler's implementation. MzScheme---the language of the PLT Scheme tool suite---addresses the problem through a macro system that separates compilation without sacrificing the expressiveness of macros."
152,153,a deoxyribozymebased molecular automaton,1181.0,A deoxyribozyme-based molecular automaton,"We describe a molecular automaton, called MAYA, which encodes a version of the game of tic-tac-toe and interactively competes against a human opponent. The automaton is a Boolean network of deoxyribozymes that incorporates 23 molecular-scale logic gates and one constitutively active deoxyribozyme arrayed in nine wells (3x3) corresponding to the game board. To make a move, MAYA carries out an analysis of the input oligonucleotide keyed to a particular move by the human opponent and indicates a move by fluorescence signaling in a response well. The cycle of human player input and automaton response continues until there is a draw or a victory for the automaton. The automaton cannot be defeated because it implements a perfect strategy."
153,154,refactoring objectoriented frameworks,1189.0,Refactoring object-oriented frameworks,"This thesis denes a set of program restructuring operations (refactorings) that support the design, evolution and reuse of object-oriented application frameworks. The focus of the thesis is on automating the refactorings in a way that preserves the behavior of a program. The refactorings are dened to be behavior preserving, provided that their preconditions are met. Most of the refactorings are simple to implement and it is almost trivial to show that they are behavior preserving. However, for a few refactorings, one or more of their preconditions are in general undecidable. Fortunately, for some cases it can be determined whether these refactorings can be applied safely. Three of the most complex refactorings are dened in detail: generalizing the inheritance hierarchy, specializing the inheritance hierarchy and using aggregations to model the relationships among classes. These operations are decomposed into more primitive parts, and the power of these operations is discussed from the perspectives of automatability and usefulness in supporting design. Two design constraints needed in refactoring are class invariants and exclusive components. These constraints are needed to ensure that behavior is preserved across some refactorings. This thesis gives some conservative algorithms for determining whether a program satises these constraints, and describes how to use this design information to refactor a program."
