,doc.id,title,citeulike.id,raw.title,raw.abstract
0,1,the metabolic world of escherichia coli is not small,42.0,The metabolic world of Escherichia coli is not small,"To elucidate the organizational and evolutionary principles of the metabolism of living organisms, recent studies have addressed the graph-theoretic analysis of large biochemical networks responsible for the synthesis and degradation of cellular building blocks [Jeong, H., Tombor, B., Albert, R., Oltvai, Z. N. \& Barab\{\'a\}si, A. L. (2000) Nature 407, 651-654; Wagner, A. \& Fell, D. A. (2001) Proc. R. Soc. London Ser. B 268, 1803-1810; and Ma, H.-W. \& Zeng, A.-P. (2003) Bioinformatics 19, 270-277]. In such studies, the global properties of the network are computed by considering enzymatic reactions as links between metabolites. However, the pathways computed in this manner do not conserve their structural moieties and therefore do not correspond to biochemical pathways on the traditional metabolic map. In this work, we reassessed earlier results by digitizing carbon atomic traces in metabolic reactions annotated for Escherichia coli. Our analysis revealed that the average path length of its metabolism is much longer than previously thought and that the metabolic world of this organism is not small in terms of biosynthesis and degradation."
1,2,reverse engineering of biological complexity,43.0,Reverse Engineering of Biological Complexity,"Advanced technologies and biology have extremely different physical implementations, but they are far more alike in systems-level organization than is widely appreciated. {C}onvergent evolution in both domains produces modular architectures that are composed of elaborate hierarchies of protocols and layers of feedback regulation, are driven by demand for robustness to uncertain environments, and use often imprecise components. {T}his complexity may be largely hidden in idealized laboratory settings and in normal operation, becoming conspicuous only when contributing to rare cascading failures. {T}hese puzzling and paradoxical features are neither accidental nor artificial, but derive from a deep and necessary interplay between complexity and robustness, modularity, feedback, and fragility. {T}his review describes insights from engineering theory and practice that can shed some light on biological complexity."
2,3,exploring complex networks,44.0,Exploring complex networks,"The study of networks pervades all of science, from neurobiology to statistical physics. {T}he most basic issues are structural: how does one characterize the wiring diagram of a food web or the {I}nternet or the metabolic network of the bacterium {E}scherichia coli? {A}re there any unifying principles underlying their topology? {F}rom the perspective of nonlinear dynamics, we would also like to understand how an enormous network of interacting dynamical systems-be they neurons, power stations or lasers-will behave collectively, given their individual dynamics and coupling architecture. {R}esearchers are only now beginning to unravel the structure and dynamics of complex networks."
3,4,comparative assessment of largescale data sets of proteinprotein interactions,46.0,Comparative assessment of large-scale data sets of protein-protein interactions.,"Comprehensive protein protein interaction maps promise to reveal many aspects of the complex regulatory network underlying cellular function. Recently, large-scale approaches have predicted many new protein interactions in yeast. To measure their accuracy and potential as well as to identify biases, strengths and weaknesses, we compare the methods with each other and with a reference set of previously reported protein interactions."
4,5,navigation in a small world,47.0,Navigation in a small world,"The small-world phenomenon — the principle that most of us are linked by short chains of acquaintances — was first investigated as a question in sociology1, 2 and is a feature of a range of networks arising in nature and technology3, 4, 5. Experimental study of the phenomenon1 revealed that it has two fundamental components: first, such short chains are ubiquitous, and second, individuals operating with purely local information are very adept at finding these chains. The first issue has been analysed2, 3, 4, and here I investigate the second by modelling how individuals can find short chains in a large social network."
5,6,random graphs with arbitrary degree distributions and their applications,48.0,Random graphs with arbitrary degree distributions and their applications.,"Recent work on the structure of social networks and the internet has focussed attention on graphs with distributions of vertex degree that are significantly different from the Poisson degree distributions that have been widely studied in the past. In this paper we develop in detail the theory of random graphs with arbitrary degree distributions. In addition to simple undirected, unipartite graphs, we examine the properties of directed and bipartite graphs. Among other results, we derive exact expressions for the position of the phase transition at which a giant component first forms, the mean component size, the size of the giant component if there is one, the mean number of vertices a certain distance away from a randomly chosen vertex, and the average vertex-vertex distance within a graph. We apply our theory to some real-world graphs, including the world-wide web and collaboration graphs of scientists and Fortune 1000 company directors. We demonstrate that in some cases random graphs with appropriate distributions of vertex degree predict with surprising accuracy the behavior of the real world, while in others there is a measurable discrepancy between theory and reality, perhaps indicating the presence of additional social structure in the network that is not captured by the random graph."
6,7,artificial gene networks for objective comparison of analysis algorithms,49.0,Artificial gene networks for objective comparison of analysis  algorithms,"Motivation: Large-scale gene expression profiling generates data sets that are rich in observed features but poor in numbers of observations. The analysis of such data sets is a challenge that has been object of vigorous research. The algorithms in use for this purpose have been poorly documented and rarely compared objectively, posing a problem of uncertainty about the outcomes of the analyses. One way to objectively test such analysis algorithms is to apply them on computational gene network models for which the mechanisms are completely know.  Results: We present a system that generates random artificial   gene networks according to well-defined topological and kinetic   properties. These are used to run in silico experiments simulating   real laboratory microarray experiments. Noise with controlled   properties is added to the simulation results several times   emulating measurement replicates, before expression ratios are calculated.  Availability: The data sets and kinetic models described here are available from http://www.vbi.vt.edu/~mendes/AGN/as  biochemical dynamic models in SBML and Gepasi formats.  Contact: mendes@vt.edu 10.1093/bioinformatics/btg1069"
7,8,the segment polarity network is a robust developmental module,50.0,The segment polarity network is a robust developmental module,"All insects possess homologous segments, but segment specification differs radically among insect orders. {I}n {D}rosophila, maternal morphogens control the patterned activation of gap genes, which encode transcriptional regulators that shape the patterned expression of pair-rule genes. {T}his patterning cascade takes place before cellularization. {P}air-rule gene products subsequently 'imprint' segment polarity genes with reiterated patterns, thus defining the primordial segments. {T}his mechanism must be greatly modified in insect groups in which many segments emerge only after cellularization. {I}n beetles and parasitic wasps, for instance, pair-rule homologues are expressed in patterns consistent with roles during segmentation, but these patterns emerge within cellular fields. {I}n contrast, although in locusts pair-rule homologues may not control segmentation, some segment polarity genes and their interactions are conserved. {P}erhaps segmentation is modular, with each module autonomously expressing a characteristic intrinsic behaviour in response to transient stimuli. {I}f so, evolution could rearrange inputs to modules without changing their intrinsic behaviours. {H}ere we suggest, using computer simulations, that the {D}rosophila segment polarity genes constitute such a module, and that this module is resistant to variations in the kinetic constants that govern its behaviour."
8,9,the evolutionary origin of complex features,52.0,The evolutionary origin of complex features.,"A long-standing challenge to evolutionary theory has been whether it can explain the origin of complex organismal features. {W}e examined this issue using digital organisms--computer programs that self-replicate, mutate, compete and evolve. {P}opulations of digital organisms often evolved the ability to perform complex logic functions requiring the coordinated execution of many genomic instructions. {C}omplex functions evolved by building on simpler functions that had evolved earlier, provided that these were also selectively favoured. {H}owever, no particular intermediate stage was essential for evolving complex functions. {T}he first genotypes able to perform complex functions differed from their non-performing parents by only one or two mutations, but differed from the ancestor by many mutations that were also crucial to the new functions. {I}n some cases, mutations that were deleterious when they appeared served as stepping-stones in the evolution of complex features. {T}hese findings show how complex functions can originate by random mutation and natural selection."
9,10,early language acquisition cracking the speech code,60.0,Early language acquisition: cracking the speech code.,"Infants learn language with remarkable speed, but how they do it remains a mystery. New data show that infants use computational strategies to detect the statistical and prosodic patterns in language input, and that this leads to the discovery of phonemes and words. Social interaction with another human being affects speech learning in a way that resembles communicative learning in songbirds. The brain's commitment to the statistical and prosodic patterns that are experienced early in life might help to explain the long-standing puzzle of why infants are better language learners than adults. Successful learning by infants, as well as constraints on that learning, are changing theories of language acquisition."
10,11,organization development and function of complex brain networks,61.0,"Organization, development and function of complex brain networks"," Recent research has revealed general principles in the structural and functional organization of complex networks which are shared by various natural, social and technological systems. This review examines these principles as applied to the organization, development and function of complex brain networks. Specifically, we examine the structural properties of large-scale anatomical and functional brain networks and discuss how they might arise in the course of network growth and rewiring. Moreover, we examine the relationship between the structural substrate of neuroanatomy and more dynamic functional and effective connectivity patterns that underlie human cognition. We suggest that network analysis offers new fundamental insights into global and integrative aspects of brain function, including the origin of flexible and coherent cognitive states within the neural architecture."
11,12,motifs in brain networks,62.0,Motifs in brain networks.,"Complex brains have evolved a highly efficient network architecture whose structural connectivity is capable of generating a large repertoire of functional states. We detect characteristic network building blocks ( structural and functional motifs) in neuroanatomical data sets and identify a small set of structural motifs that occur in significantly increased numbers. Our analysis suggests the hypothesis that brain networks maximize both the number and the diversity of functional motifs, while the repertoire of structural motifs remains small. Using functional motif number as a cost function in an optimization algorithm, we obtain network topologies that resemble real brain networks across a broad spectrum of structural measures, including small-world attributes. These results are consistent with the hypothesis that highly evolved neural architectures are organized to maximize functional repertoires and to support highly efficient integration of information."
12,13,diffusion on complex networks a way to probe their large scale topological structures,97.0,Diffusion on Complex Networks : A way to probe their large scale topological structures,"A diffusion process on complex networks is introduced in order to uncover their large scale topological structures. This is achieved by focusing on the slowest decaying diffusive modes of the network. The proposed procedure is applied to real-world networks like a friendship network of known modular structure, and an Internet routing network. For the friendship network, its known structure is well reproduced. In case of the Internet, where the structure is far less well-known, one indeed finds a modular structure, and modules can roughly be associated with individual countries. Quantitatively the modular structure of the Internet manifests itself in an approximately 10 times larger participation ratio of its slowest decaying modes as compared to the null model -- a random scale-free network. The extreme edges of the Internet are found to correspond to Russian and US military sites."
13,14,topological generalizations of network motifs,98.0,Topological Generalizations of network motifs,"Biological and technological networks contain patterns, termed network motifs, which occur far more often than in randomized networks. {N}etwork motifs were suggested to be elementary building blocks that carry out key functions in the network. {I}t is of interest to understand how network motifs combine to form larger structures. {T}o address this, we present a systematic approach to define ""motif generalizations"": families of motifs of different sizes that share a common architectural theme. {T}o define motif generalizations, we first define ""roles"" in a subgraph according to structural equivalence. {F}or example, the feedforward loop triad--a motif in transcription, neuronal, and some electronic networks--has three roles: an input node, an output node, and an internal node. {T}he roles are used to define possible generalizations of the motif. {T}he feedforward loop can have three simple generalizations, based on replicating each of the three roles and their connections. {W}e present algorithms for efficiently detecting motif generalizations. {W}e find that the transcription networks of bacteria and yeast display only one of the three generalizations, the multi-output feedforward generalization. {I}n contrast, the neuronal network of {C}. elegans mainly displays the multi-input generalization. {F}orward-logic electronic circuits display a multi-input, multi-output hybrid. {T}hus, networks which share a common motif can have very different generalizations of that motif. {U}sing mathematical modeling, we describe the information processing functions of the different motif generalizations in transcription, neuronal, and electronic networks."
14,15,collective dynamics of smallworld networks,99.0,Collective dynamics of 'small-world' networks.,"Networks of coupled dynamical systems have been used to model biological oscillators1, 2, 3, 4, Josephson junction arrays5,6, excitable media7, neural networks8, 9, 10, spatial games11, genetic control networks12 and many other self-organizing systems. Ordinarily, the connection topology is assumed to be either completely regular or completely random. But many biological, technological and social networks lie somewhere between these two extremes. Here we explore simple models of networks that can be tuned through this middle ground: regular networks 'rewired' to introduce increasing amounts of disorder. We find that these systems can be highly clustered, like regular lattices, yet have small characteristic path lengths, like random graphs. We call them 'small-world' networks, by analogy with the small-world phenomenon13,14 (popularly known as six degrees of separation15). The neural network of the worm Caenorhabditis elegans, the power grid of the western United States, and the collaboration graph of film actors are shown to be small-world networks. Models of dynamical systems with small-world coupling display enhanced signal-propagation speed, computational power, and synchronizability. In particular, infectious diseases spread more easily in small-world networks than in regular lattices."
15,16,network motifs simple building blocks of complex networks,101.0,Network motifs: simple building blocks of complex networks.,"Complex networks are studied across many fields of science. {T}o uncover their structural design principles, we defined ""network motifs,"" patterns of interconnections occurring in complex networks at numbers that are significantly higher than those in randomized networks. {W}e found such motifs in networks from biochemistry, neurobiology, ecology, and engineering. {T}he motifs shared by ecological food webs were distinct from the motifs shared by the genetic networks of {E}scherichia coli and {S}accharomyces cerevisiae or from those found in the {W}orld {W}ide {W}eb. {S}imilar motifs were found in networks that perform information processing, even though they describe elements as different as biomolecules within a cell and synaptic connections between neurons in {C}aenorhabditis elegans. {M}otifs may thus define universal classes of networks. {T}his approach may uncover the basic building blocks of most networks."
16,17,authoritative sources in a hyperlinked environment,102.0,Authoritative sources in a hyperlinked environment,"The network structure of a hyperlinked environment can be a rich source of in- formation about the content of the environment, provided we have eective means for understanding it. We develop a set of algorithmic tools for extracting information from the link structures of such environments, and report on experiments that demonstrate their eectiveness in a variety of contexts on the World Wide Web. The central issue we address within our framework is the distillation of broad search topics, through the discovery of \authoritative"" information sources on such topics. We propose and test an algorithmic formulation of the notion of authority, based on the relationship between a set of relevant authoritative pages and the set of \hub pages"" that join them together in the link structure. Our formulation has connections to the eigenvectors of certain matrices associated with the link graph; these connections in turn motivate additional heuristics for link-based analysis.  We began with the goal of discovering authoritative pages, but our approach in fact identies a more complex pattern of social organization on the www, in which hub pages link densely to a set of thematically related authorities. This equilibrium between hubs and authorities is a phenomenon that recurs in the context of a wide variety of topics on the www. Measures of impact and influence in bibliometrics have typically lacked, and arguably not required, an analogous formulation of the role that hubs play; the www is very dierent from the scientic literature, and our framework seems appropriate as a model of the way in which authority is conferred in an environment such as the Web."
17,18,the anatomy of a largescale hypertextual web search engine,114.0,The anatomy of a large-scale hypertextual Web search engine,"Abstract In this paper, we present Google, a prototype of a large-scale search engine which makes heavy use of the structure present in hypertext. Google is designed to crawl and index the Web efficiently and produce much more satisfying search results than existing systems. The prototype with a full text and hyperlink database of at least 24 million pages is available at http:// google.stanford.edu/ To engineer a search engine is a challenging task. Search engines index tens to hundreds of millions of web pages involving a comparable number of distinct terms. They answer tens of millions of queries every day. Despite the importance of large-scale search engines on the web, very little academic research has been done on them. Furthermore, due to rapid advance in technology and web proliferation, creating a web search engine today is very different from three years ago. This paper provides an in-depth description of our large-scale web search engine -- the first such detailed public description we know of to date. Apart from the problems of scaling traditional search techniques to data of this magnitude, there are new technical challenges involved with using the additional information present in hypertext to produce better search results. This paper addresses this question of how to build a practical largescale system which can exploit the additional information present in hypertext. Also we look at the problem of how to effectively deal with uncontrolled hypertext collections where anyone can publish anything they want."
18,19,spectra and eigenvectors of scalefree networks,122.0,Spectra and eigenvectors of scale-free networks.,"We study the spectra and eigenvectors of the adjacency matrices of scale-free networks when bidirectional interaction is allowed, so that the adjacency matrix is real and symmetric. The spectral density shows an exponential decay around the center, followed by power-law long tails at both spectrum edges. The largest eigenvalue lambda1 depends on system size N as lambda1 approximately N1/4 for large N, and the corresponding eigenfunction is strongly localized at the hub, the vertex with largest degree. The component of the normalized eigenfunction at the hub is of order unity. We also find that the mass gap scales as N(-0.68)."
20,21,functional discovery via a compendium of expression profiles,124.0,Functional discovery via a compendium of expression profiles.,"Ascertaining the impact of uncharacterized perturbations on the cell is a fundamental problem in biology. Here, we describe how a single assay can be used to monitor hundreds of different cellular functions simultaneously. We constructed a reference database or “compendium” of expression profiles corresponding to 300 diverse mutations and chemical treatments in S. cerevisiae , and we show that the cellular pathways affected can be determined by pattern matching, even among very subtle profiles. The utility of this approach is validated by examining profiles caused by deletions of uncharacterized genes: we identify and experimentally confirm that eight uncharacterized open reading frames encode proteins required for sterol metabolism, cell wall function, mitochondrial respiration, or protein synthesis. We also show that the compendium can be used to characterize pharmacological perturbations by identifying a novel target of the commonly used drug dyclonine."
21,22,growing and navigating the small world web by local content,127.0,Growing and navigating the small world Web by local content.,"Can we model the scale-free distribution of Web hypertext degree under realistic assumptions about the behavior of page authors? Can a Web crawler efficiently locate an unknown relevant page? These questions are receiving much attention due to their potential impact for understanding the structure of the Web and for building better search engines. Here I investigate the connection between the linkage and content topology of Web pages. The relationship between a text-induced distance metric and a link-based neighborhood probability distribution displays a phase transition between a region where linkage is not determined by content and one where linkage decays according to a power law. This relationship is used to propose a Web growth model that is shown to accurately predict the distribution of Web page degree, based on textual content and assuming only local knowledge of degree for existing pages. A qualitatively similar phase transition is found between linkage and semantic distance, with an exponential decay tail. Both relationships suggest that efficient paths can be discovered by decentralized Web navigation algorithms based on textual and/or categorical cues."
22,23,the structure of scientific collaboration networks,128.0,The structure of scientific collaboration networks,"The structure of scientific collaboration networks is investigated. Two scientists are considered connected if they have authored a paper together and explicit networks of such connections are constructed by using data drawn from a number of databases, including MEDLINE (biomedical research), the Los Alamos e-Print Archive (physics), and NCSTRL (computer science). I show that these collaboration networks form âsmall worlds,â in which randomly chosen pairs of scientists are typically separated by only a short path of intermediate acquaintances. I further give results for mean and distribution of numbers of collaborators of authors, demonstrate the presence of clustering in the networks, and highlight a number of apparent differences in the patterns of collaboration between the fields studied."
